{
  "report_id": "project05-m3star-phase3-candidate-002-curator-checkpoint-v1.1",
  "status": "curator_staged_qualification_checkpoint",
  "report_created_utc": "2026-07-20T05:39:54.963378Z",
  "amendment_id": "project05-m3star-blind-staged-acquisition-amendment-v0.2",
  "amendment_sha256": "e893c7e764d96ce1ac095d3b60d922b5f24ae9b14577f314ee13b5805df5747f",
  "curation_and_seal_separation": {
    "curation_team_id": "project05-isolated-curator-phase1-20260719",
    "model_development_team_id": "project05-model-development",
    "ground_truth_custodian_id": "project05-ground-truth-custodian-sealed",
    "teams_are_disjoint": true,
    "curator_blind_to_model_outputs": true,
    "model_developers_blind_to_candidate_payloads": true,
    "ground_truth_custodian_distinct_from_curator_and_model_developer": true
  },
  "non_consuming_disclosure_boundary": {
    "telemetry_contents_returned_to_model_development": false,
    "labels_returned_to_model_development": false,
    "ground_truth_returned_to_model_development": false,
    "attack_narratives_returned_to_model_development": false,
    "cost_values_returned_to_model_development": false,
    "model_outputs_opened_during_qualification": false
  },
  "source_artifact_hash_ledger_id": "project05-m3star-staged-source-artifact-hash-ledger-summary-v1.1",
  "phase_1_source_results": [
    {
      "source_id": "otrf-security-datasets-compound",
      "candidate_key": null,
      "planned_candidate_slots": 9,
      "qualified_count": 7,
      "not_qualified_count": 2,
      "attrition_reason_counts": {
        "parameter_or_representation_variant": 2
      },
      "all_planned_slots_audited": true
    },
    {
      "source_id": "splunk-attack-data-apt-simulations",
      "candidate_key": null,
      "planned_candidate_slots": 1,
      "qualified_count": 1,
      "not_qualified_count": 0,
      "attrition_reason_counts": {},
      "all_planned_slots_audited": true
    },
    {
      "source_id": "cam-lds",
      "candidate_key": null,
      "planned_candidate_slots": 7,
      "qualified_count": 7,
      "not_qualified_count": 0,
      "attrition_reason_counts": {},
      "all_planned_slots_audited": true
    },
    {
      "source_id": "mscad",
      "candidate_key": null,
      "planned_candidate_slots": 2,
      "qualified_count": 2,
      "not_qualified_count": 0,
      "attrition_reason_counts": {},
      "all_planned_slots_audited": true
    },
    {
      "source_id": "dapt2020",
      "candidate_key": null,
      "planned_candidate_slots": 1,
      "qualified_count": 1,
      "not_qualified_count": 0,
      "attrition_reason_counts": {},
      "all_planned_slots_audited": true
    },
    {
      "source_id": "capd",
      "candidate_key": null,
      "planned_candidate_slots": 23,
      "qualified_count": 23,
      "not_qualified_count": 0,
      "attrition_reason_counts": {},
      "all_planned_slots_audited": true
    },
    {
      "source_id": "goose-power-substation-apt",
      "candidate_key": null,
      "planned_candidate_slots": 1,
      "qualified_count": 1,
      "not_qualified_count": 0,
      "attrition_reason_counts": {},
      "all_planned_slots_audited": true
    },
    {
      "source_id": "cyber-czech-2019",
      "candidate_key": null,
      "planned_candidate_slots": 1,
      "qualified_count": 1,
      "not_qualified_count": 0,
      "attrition_reason_counts": {},
      "all_planned_slots_audited": true
    },
    {
      "source_id": "windows-apt-2025",
      "candidate_key": null,
      "planned_candidate_slots": 31,
      "qualified_count": 0,
      "not_qualified_count": 31,
      "attrition_reason_counts": {
        "incomplete_campaign_boundary": 31
      },
      "all_planned_slots_audited": true
    },
    {
      "source_id": "attackmate-evaluation-data",
      "candidate_key": null,
      "planned_candidate_slots": 3,
      "qualified_count": 3,
      "not_qualified_count": 0,
      "attrition_reason_counts": {},
      "all_planned_slots_audited": true
    },
    {
      "source_id": "attackmate-robotdog",
      "candidate_key": null,
      "planned_candidate_slots": 1,
      "qualified_count": 0,
      "not_qualified_count": 1,
      "attrition_reason_counts": {
        "incomplete_host_or_sensor_coverage": 1
      },
      "all_planned_slots_audited": true
    },
    {
      "source_id": "ainception-storylines",
      "candidate_key": "SL100",
      "planned_candidate_slots": 1,
      "qualified_count": 1,
      "not_qualified_count": 0,
      "attrition_reason_counts": {},
      "all_planned_slots_audited": true
    }
  ],
  "sequential_candidate_results": [
    {
      "phase": 2,
      "phase_candidate_index": 1,
      "source_id": "ait-log-data-set-v2.1",
      "candidate_key": "russellmitchell",
      "qualification_status": "qualified",
      "attrition_reason": null
    },
    {
      "phase": 2,
      "phase_candidate_index": 2,
      "source_id": "ait-log-data-set-v2.1",
      "candidate_key": "santos",
      "qualification_status": "qualified",
      "attrition_reason": null
    },
    {
      "phase": 2,
      "phase_candidate_index": 3,
      "source_id": "ait-log-data-set-v2.1",
      "candidate_key": "harrison",
      "qualification_status": "qualified",
      "attrition_reason": null
    },
    {
      "phase": 2,
      "phase_candidate_index": 4,
      "source_id": "ait-log-data-set-v2.1",
      "candidate_key": "fox",
      "qualification_status": "qualified",
      "attrition_reason": null
    },
    {
      "phase": 2,
      "phase_candidate_index": 5,
      "source_id": "ait-log-data-set-v2.1",
      "candidate_key": "wheeler",
      "qualification_status": "qualified",
      "attrition_reason": null
    },
    {
      "phase": 2,
      "phase_candidate_index": 6,
      "source_id": "ait-log-data-set-v2.1",
      "candidate_key": "wardbeck",
      "qualification_status": "qualified",
      "attrition_reason": null
    },
    {
      "phase": 2,
      "phase_candidate_index": 7,
      "source_id": "ait-log-data-set-v2.1",
      "candidate_key": "wilson",
      "qualification_status": "qualified",
      "attrition_reason": null
    },
    {
      "phase": 2,
      "phase_candidate_index": 8,
      "source_id": "ait-log-data-set-v2.1",
      "candidate_key": "shaw",
      "qualification_status": "qualified",
      "attrition_reason": null
    },
    {
      "phase": 3,
      "phase_candidate_index": 1,
      "source_id": "apt-sandworm-dataset",
      "candidate_key": "campaign",
      "qualification_status": "qualified",
      "attrition_reason": null
    },
    {
      "phase": 3,
      "phase_candidate_index": 2,
      "source_id": "locked-shields-partners-run-23",
      "candidate_key": "LSPR23",
      "qualification_status": "qualified",
      "attrition_reason": null
    }
  ],
  "audited_candidate_count": 91,
  "reported_qualified_count": 57,
  "reported_not_qualified_count": 34,
  "unaudited_reserve_count": 4,
  "qualified_cases": [
    {
      "qualification_case_id": "QB-001",
      "source_id": "otrf-security-datasets-compound",
      "candidate_key": null,
      "source_cluster_id": "otrf-security-datasets",
      "source_release_id": "d9d40ef123d2c87d5d3df28c96bcab4f0faccc87",
      "source_artifact_sha256": "0d12386d1508c1a63fd87e33f8499e492da719d18dc839e9bb9e160e66d4402e",
      "scenario_family_sha256": "a47b0afe5787f5940982251c2538a0947bad2d35809eb5a77a8e3b88f37bf463",
      "attack_chain_definition_sha256": "ba24173b098bc87efb0c786a4e38cfb8edfab029778a2c1b82f563780f321288",
      "campaign_execution_sha256": "06f8b0c74da0ffccc22beaa48412f511d2135892ca80ee362e9a2249a6154acb",
      "telemetry_capture_sha256": "8a4a977872a6cbbfa7dc25109903a7c8468d86cb8164dff054d45f27827b62f4",
      "original_telemetry_present": true,
      "multi_stage_attack_chain_present": true,
      "full_campaign_time_window_included": true,
      "all_in_scope_campaign_hosts_combined": true,
      "not_a_host_slice": true,
      "not_a_time_slice": true,
      "not_a_mask_variant": true,
      "not_a_parameter_only_variant": true,
      "not_used_in_model_development": true,
      "cost_measurement_scope_supported": true,
      "ground_truth_sealed": true,
      "cost_values_sealed_from_model_development": true,
      "ground_truth_seal_id": "GTSEAL-27fc4cf683df643106920648",
      "cost_measurement_seal_id": "COSTSEAL-bd3ba31c76c826d98d913618"
    },
    {
      "qualification_case_id": "QB-002",
      "source_id": "otrf-security-datasets-compound",
      "candidate_key": null,
      "source_cluster_id": "otrf-security-datasets",
      "source_release_id": "d9d40ef123d2c87d5d3df28c96bcab4f0faccc87",
      "source_artifact_sha256": "c42af16e55440b51f0ed477bb207db7e8dfa6679cb13d109cdad87a5bdd43509",
      "scenario_family_sha256": "ca2ede4a89d518c18206b7b215507e5b4a908a1c30cbb589a1f24746a9667b84",
      "attack_chain_definition_sha256": "abe44e2661cb71bb7e7c89585efcff9e8407292e7cfded790c0c41e5a910bf9e",
      "campaign_execution_sha256": "e39b8c3ba97483c8b2d17a4284a47afda8ed11f4fb3be98ba64d5d5a8b7f2b8e",
      "telemetry_capture_sha256": "aedd93b8b92629842907c9d1b5ca2e814614249493eb1aa112e4a528fa87cf9a",
      "original_telemetry_present": true,
      "multi_stage_attack_chain_present": true,
      "full_campaign_time_window_included": true,
      "all_in_scope_campaign_hosts_combined": true,
      "not_a_host_slice": true,
      "not_a_time_slice": true,
      "not_a_mask_variant": true,
      "not_a_parameter_only_variant": true,
      "not_used_in_model_development": true,
      "cost_measurement_scope_supported": true,
      "ground_truth_sealed": true,
      "cost_values_sealed_from_model_development": true,
      "ground_truth_seal_id": "GTSEAL-ab1a6e187a852d1bcd93aced",
      "cost_measurement_seal_id": "COSTSEAL-daacf2917198efb7ba9df325"
    },
    {
      "qualification_case_id": "QB-003",
      "source_id": "otrf-security-datasets-compound",
      "candidate_key": null,